Inteiro Teor;Título;Estágio;Órgão;Amostras
https://pje.trt2.jus.br/jurisprudencia/914d0881050e339ad3a6e8be779a8501;Processo ATOrd - 1000880-81.2024.5.02.0315;Sentença - Data de assinatura: 19/11/2024;Órgão julgador: 5ª Vara do Trabalho de Guarulhos;"• A reclamante postulou indenização por danos morais em razão de ter ""sua bolsa revirada pela então supervisora Suellen, dentro do seu próprio armário, procurando supostas NF’s que deduziu estar sob posse da obreira"" e também em razão das condições de trabalho (""todas as vezes em que chegava mercadorias, tinha a necessidade de descarregar caixa contendo 50 kgs cada ou mais, pois continham em tornos de 10 sacos de arroz de 5kgs, sabão em pó, além de diariamente..."
https://pje.trt2.jus.br/jurisprudencia/61bbd7d826c69bcceb6bd21e49908cc6;Processo ROT - 1001050-38.2023.5.02.0008;Acórdão - Data de assinatura: 18/11/2024;Relator(a): Candida Alves Leao;Amostras do Inteiro Teor:
https://pje.trt2.jus.br/jurisprudencia/0a06792a75d08c0ceece6a424fba0d64;Processo ATOrd - 1001544-85.2023.5.02.0303;Sentença - Data de assinatura: 18/11/2024;Órgão julgador: 3ª Vara do Trabalho de Guarujá;"• A única testemunha ouvida, por sua vez, afirmou que desde a contratação “pegavam as mercadorias que chegavam (hortifrutis, arroz, feijão; que também limpavam a cozinha; que sempre fizeram esse serviço desde que foram contratadas” (fl. 2830), deixando claro que nem mesmo ocorreu alteração nas funções, que sempre foram as mesmas...."
https://pje.trt2.jus.br/jurisprudencia/cdaffcec64796b4fb1576cb64321e4ff;Processo ROT - 1000315-43.2023.5.02.0060;Acórdão - Data de assinatura: 10/09/2024;Relator(a): Elza Eiko Mizuno;Amostras do Inteiro Teor:
https://pje.trt2.jus.br/jurisprudencia/3f449493cc797ffa2b392fd9012a197b;Processo ATSum - 1000667-41.2024.5.02.0391;Sentença - Data de assinatura: 09/09/2024;Órgão julgador: Vara do Trabalho de Poá;• Quanto aos alimentos vencidos e estragados, a testemunha ouvida a rogo da reclamante afirmou que acharam larvas no arroz, caramujo, fizeram a reclamação, não foi feito nada, depois a vigilância sanitária interveio e foi recolhido. Usaram os alimentos no preparo, reclamante, alunos e professores passaram mal e ninguém fiscalizava os alimentos....
https://pje.trt2.jus.br/jurisprudencia/d35d4ad4854ebf426d7cb7f8276544eb;Processo ATOrd - 1000199-48.2024.5.02.0433;Sentença - Data de assinatura: 06/09/2024;Órgão julgador: 3ª Vara do Trabalho de Santo André;"• Em audiência o reclamante disse que ""a empresa oferecia como refeição lanche, batata e refrigerante, não serviam salada, fruta, suco, arroz”...."
https://pje.trt2.jus.br/jurisprudencia/e68a424a78ce7f890d726a914cb95535;Processo ATOrd - 1001000-82.2023.5.02.0502;Sentença - Data de assinatura: 05/09/2024;Órgão julgador: 2ª Vara do Trabalho de Taboão da Serra;"• No caso, conforme depoimento da testemunha Vinicius, ""Que trabalhou na reclamada de 2019 a 2023, como separador de mercadorias; que o depoente separava refrigerante, cervejas, produtos de limpeza; que eram embalagens, packs e caixas; que tinham que separar 10.000 toneladas por dia; que faziam rodízio nos setores durante a semana, por isso o depoente também trabalhava no setor de arroz, feijão, etc; que o reclamante também fazia esse tipo de rodízio; que as caixas de palmito..."
https://pje.trt2.jus.br/jurisprudencia/344b33b923fcb0a42eee6f0f008fb4a3;Processo ROT - 1000429-90.2023.5.02.0703;Acórdão - Data de assinatura: 05/09/2024;Relator(a): Silza Helena Bermudes Bauman;Amostras do Inteiro Teor:
https://pje.trt2.jus.br/jurisprudencia/0b393c3fcf57e78752a3da334f606681;Processo ATSum - 1001985-42.2023.5.02.0602;Sentença - Data de assinatura: 05/09/2024;Órgão julgador: 2ª Vara do Trabalho de São Paulo - Zona Leste;"• Ademais, a testemunha também declarou que “a cozinheira Maria preparava o almoço e o que sobrava, era aproveitado na janta; que as ajudantes só complementavam o que faltava (o arroz, por exemplo)” (fl. 200), do que se permite deduzir que não exerciam plenamente a função de cozinheira...."
https://pje.trt2.jus.br/jurisprudencia/632a401c4191d2ff61b686fdcbaaac4b;Processo ROT - 1000018-35.2022.5.02.0201;Acórdão - Data de assinatura: 05/09/2024;Relator(a): Magda Cardoso Mateus Silva;Amostras do Inteiro Teor:
https://pje.trt2.jus.br/jurisprudencia/aca5e206e20f3130de9d7f4cc61d1df8;Processo ROT - 1000033-89.2023.5.02.0323;Acórdão - Data de assinatura: 04/09/2024;Relator(a): Roberto Vieira de Almeida Rezende;Amostras do Inteiro Teor:
https://pje.trt2.jus.br/jurisprudencia/422ff781a67b3c3fb9669b9e77658292;Processo ROT - 1000262-63.2023.5.02.0383;Acórdão - Data de assinatura: 03/09/2024;Relator(a): Renata de Paula Eduardo Beneti;Ementa:
https://pje.trt2.jus.br/jurisprudencia/afba3f5e5738335a806a22c0a28e7d60;Processo ATOrd - 1000676-76.2023.5.02.0087;Sentença - Data de assinatura: 03/09/2024;Órgão julgador: 87ª Vara do Trabalho de São Paulo;"• Leandro, disse em síntese que: o reclamante teve um acidente e a testemunha ficou no lugar dele por 3 dias; quando o reclamante faltava, a testemunha ficava no lugar dele; a testemunha fazia das 11 às 17; no fim do expediente davam arroz e feijão; a testemunha tinha sua própria moto e o reclamante também; a substituição foi mais de 10 vezes, não se lembra bem; o reclamante ligava para a testemunha e esta ia no lugar dele; chegava a fazer em torno de 10/13 entregas; já teve dias de fazer 2/3 entregas; a diária..."
https://pje.trt2.jus.br/jurisprudencia/160619a97606ca25e5149ff6c63517e8;Processo ATOrd - 1000098-66.2024.5.02.0059;Sentença - Data de assinatura: 30/08/2024;Órgão julgador: 59ª Vara do Trabalho de São Paulo;"• das 10h30 às 19h; que o mesmo era da reclamante; que trabalhava feriado normal, com o mesmo horário; que faziam uma pausa de 15 minutos; que a reclamante atendia caixa, fazia comida, preparava os insumos, lavava banheiro, tirava o lixo, atendia os clientes; que isso era frequente; que o banheiro era limpo 3x por dia; que estima umas 70 pessoas por dia de circulação na reclamada; que o Geraldo fazia as comidas às vezes, de manhã, e à tarde era a reclamante; que não se recorda o que era feito à tarde, mas era arroz..."
https://pje.trt2.jus.br/jurisprudencia/ed771270ab4edb8b7816045b02982e9b;Processo RORSum - 1000120-90.2024.5.02.0038;Acórdão - Data de assinatura: 30/08/2024;Relator(a): Kyong Mi Lee;Amostras do Inteiro Teor:
https://pje.trt2.jus.br/jurisprudencia/049f575eb8d66ffad22f80ab356cef67;Processo ATSum - 1000889-97.2023.5.02.0082;Sentença - Data de assinatura: 29/08/2024;Órgão julgador: 82ª Vara do Trabalho de São Paulo;"• A perita do juízo, por seu turno, registrou inicialmente, que as principais atividades do autor consistiam em ""posicionar e organizar mercadorias provenientes da mercearia (exemplos: vinhos,refrigentes,farinados, feijao,arroz, entre outros .Referidos produtos eram retirados do depósito fazendo uso carrinho hidráulico; Recolher carrinhos de uso de clientes distribuidos pela loja; Eventualmente, se ativou na montagem de plataformas...."
https://pje.trt2.jus.br/jurisprudencia/bf8860250802937371a111c1db76edb9;Processo ATOrd - 1001590-15.2022.5.02.0431;Sentença - Data de assinatura: 29/08/2024;Órgão julgador: 1ª Vara do Trabalho de Santo André;"• Disse a testemunha: "" que o acidente aconteceu da seguinte forma: que ao descer com o autor um carrinho de arroz pela rampa íngreme, como carrinho estava pesado, não conseguiu segurar o carrinho, ele acabou prensando a perna do autor no corrimão; que o elevador estava quebrado, que desceu o carrinho por determinação do supervisor Jefferson, que o autor estava de costas para a rampa e o depoente guiando o carrinho pela frente.""..."
https://pje.trt2.jus.br/jurisprudencia/10f60c1536f38a4a2e8bcf4dfd71f5e1;Processo ROT - 1001049-31.2022.5.02.0447;Acórdão - Data de assinatura: 29/08/2024;Relator(a): Beatriz Helena Miguel Jiacomini;Ementa:
https://pje.trt2.jus.br/jurisprudencia/522557cca99394fd63a7b56548e38d2f;Processo EDCiv - 1000499-44.2020.5.02.0467;Acórdão - Data de assinatura: 28/08/2024;Relator(a): Ricardo Artur Costa e Trigueiros;Amostras do Inteiro Teor:
https://pje.trt2.jus.br/jurisprudencia/2ed827737fec618eba1aa30e8f0c622b;Processo ROT - 1001243-22.2023.5.02.0374;Acórdão - Data de assinatura: 28/08/2024;Relator(a): Thais Verrastro de Almeida;Ementa:
https://pje.trt2.jus.br/jurisprudencia/08e42c3a683b579cf13d04e1b9fae6f9;Processo RORSum - 1001257-48.2022.5.02.0048;Acórdão - Data de assinatura: 28/08/2024;Relator(a): Dulce Maria Soler Gomes Rijo;Amostras do Inteiro Teor:
https://pje.trt2.jus.br/jurisprudencia/69ce9e0a87328618f2f228facfafeb2d;Processo ROT - 1000252-82.2022.5.02.0050;Acórdão - Data de assinatura: 28/08/2024;Relator(a): Thais Verrastro de Almeida;Ementa:
https://pje.trt2.jus.br/jurisprudencia/de1e7b4244acfa78855660327ecf60bb;Processo RORSum - 1001449-10.2023.5.02.0609;Acórdão - Data de assinatura: 28/08/2024;Relator(a): Ivani Contini Bramante;Ementa:
https://pje.trt2.jus.br/jurisprudencia/d953a95af4d550531f991d8483aceb57;Processo ATOrd - 1000599-59.2023.5.02.0025;Sentença - Data de assinatura: 28/08/2024;Órgão julgador: 25ª Vara do Trabalho de São Paulo;• Ademais, a própria reclamante declarada, em sua petição inicial, que era fornecida alimentação composta de arroz e feijão, não tendo restado comprovada a alegação de que tinha apenas 5 a 10 minutos para se alimentar.Pelo exposto, julgo improcedente o pedido....
https://pje.trt2.jus.br/jurisprudencia/90f87b02b5b8e5e9a188de92371bd1ac;Processo ATSum - 1000356-09.2024.5.02.0049;Sentença - Data de assinatura: 27/08/2024;Órgão julgador: 49ª Vara do Trabalho de São Paulo;"• - Efetuar a cocção de ingredientes, tais como: feijão, arroz, batata, molhos;- Efetuar corte de carnes, frangos e outros para porcionamento;..."
https://pje.trt2.jus.br/jurisprudencia/c0aa206f8424f3450321dd1b09e1fea2;Processo ATOrd - 1000369-37.2024.5.02.0007;Sentença - Data de assinatura: 25/08/2024;Órgão julgador: 7ª Vara do Trabalho de São Paulo;• Aduz que: “sempre ofereceu a todos os seus empregados um cardápio balanceado, composto de arroz, feijão, carnes, saladas, sucos e frutas, conforme consta no cardápio conhecido na empresa de “MY BREAK”, e o Reclamante sempre usufruiu desse benefício....
https://pje.trt2.jus.br/jurisprudencia/b75571339644e346a3542f867ce577bd;Processo ATOrd - 1001833-72.2023.5.02.0382;Sentença - Data de assinatura: 23/08/2024;Órgão julgador: 2ª Vara do Trabalho de Osasco;• “3 – Sim, não foi apurado peso, mas carregava latas de óleo, fardos de arroz, feijão e outras caixas pesadas de diversos produtos, portanto, caracterizando a aparição de hérnia umbilical.”....
https://pje.trt2.jus.br/jurisprudencia/3a3e0563b197345638531f7bdbb1f9c7;Processo ATSum - 1000085-31.2024.5.02.0362;Sentença - Data de assinatura: 22/08/2024;Órgão julgador: 2ª Vara do Trabalho de Mauá;• Ao realizar a vistoria, o perito constatou que o autor tinha como atividade a reposição do arroz Sorriso no local da diligência (ASSAI ATACADISTA) e em mais cinco outros hipermercados da região do grande ABCDM, e assim retirava o arroz do estoque e abastecia a área pública de vendas da mercearia seca existente nos hipermercados....
https://pje.trt2.jus.br/jurisprudencia/0110186cfbb4dd913adbc168a1c86d17;Processo RORSum - 1000182-41.2023.5.02.0467;Acórdão - Data de assinatura: 22/08/2024;Relator(a): Fernanda Oliva Cobra Valdivia;Amostras do Inteiro Teor:
https://pje.trt2.jus.br/jurisprudencia/e2933957258eb1a5c5c35533c444c29d;Processo ROT - 1002457-56.2015.5.02.0462;Acórdão - Data de assinatura: 22/08/2024;Relator(a): Simone Fritschy Louro;Amostras do Inteiro Teor:
https://pje.trt2.jus.br/jurisprudencia/4a3ef20f6da2b4a219d88765e442dac4;Processo ROT - 1001012-27.2023.5.02.0331;Acórdão - Data de assinatura: 22/08/2024;Relator(a): Maria Ines Re Soriano;Amostras do Inteiro Teor:
https://pje.trt2.jus.br/jurisprudencia/896e0e42d9fcfbcbe9f5695ceb05498b;Processo ROT - 1000805-26.2020.5.02.0301;Acórdão - Data de assinatura: 21/08/2024;Relator(a): Magda Cardoso Mateus Silva;Amostras do Inteiro Teor:
https://pje.trt2.jus.br/jurisprudencia/53bb996be701e8adf668b8ae257d039c;Processo ROT - 1001830-06.2023.5.02.0710;Acórdão - Data de assinatura: 21/08/2024;Relator(a): Catarina Von Zuben;Ementa:
https://pje.trt2.jus.br/jurisprudencia/2feff54a4a319b24e220ee5b2bb0ad00;Processo ATOrd - 1000957-39.2023.5.02.0602;Sentença - Data de assinatura: 21/08/2024;Órgão julgador: 2ª Vara do Trabalho de São Paulo - Zona Leste;• Manipulava produtos como: fardos de arroz de 25kg, fardos de feijão de 30kg, caixa de carnes com 25kg, frango 30kg, leite 12kg, caixas de hortifrutis como vagem, cenoura, brócolis com 20kg, fardo de óleo, saco de temperos. Recebia em média 10 caminhões de entrega. Organizava os produtos de maneira manual. Durante 1 hora do turno, ia para cozinha para realizar preparo de legumes, higienização e corte....
https://pje.trt2.jus.br/jurisprudencia/f791682be7ea27db9a837d150777a899;Processo ATOrd - 1000195-81.2024.5.02.0054;Sentença - Data de assinatura: 20/08/2024;Órgão julgador: 54ª Vara do Trabalho de São Paulo;• A respeito dessa questão, a reclamante, em seu depoimento pessoal admitiu: “que havia arroz com feijão no local, havendo também sucos e frutas disponíveis, além da proteína”....
https://pje.trt2.jus.br/jurisprudencia/82bc1fc5a2a9a0541e98a865c619ca84;Processo ATOrd - 1000732-82.2024.5.02.0020;Sentença - Data de assinatura: 18/08/2024;Órgão julgador: 20ª Vara do Trabalho de São Paulo;• De análise dos vídeos, observa-se que, embora as carnes, sacos de arroz e outros produtos mencionados pela ré tenham sido bipados (considerando que produtos semelhantes podem ser bipados apenas uma vez, com o registro manual da quantidade de itens pela empregada), não há evidências do registro das bandejas de ovo, por exemplo, o que corrobora a fraude alegada pela reclamada....
https://pje.trt2.jus.br/jurisprudencia/69af435907df155a6d75aaec6ddbf2af;Processo ATOrd - 1000110-94.2024.5.02.0604;Sentença - Data de assinatura: 16/08/2024;Órgão julgador: 4ª Vara do Trabalho de São Paulo - Zona Leste;"• utensílios da cozinha em geral, repor comida na rampa (Buffet) durante o horário das refeições, higienizar as frutas, verduras e legumes, auxiliar na preparação de alimentos, auxiliar no preparo de café, coffee break; Como ½ OFICIAL DE COZINHA, durante o período de 01/08/2021 a 30/04/2023 que correspondiam em realizar serviços diversos na área da cozinha, executar atividades relacionadas ao preparo das refeições, preparar carnes, guarnições, molhos para o prato principal, arroz..."
https://pje.trt2.jus.br/jurisprudencia/e45cfbac80127b35fb030e1352605f56;Processo ATSum - 1000218-43.2024.5.02.0081;Sentença - Data de assinatura: 16/08/2024;Órgão julgador: 81ª Vara do Trabalho de São Paulo;"• A esse respeito, a testigo da reclamante asseverou que: “a reclamada fornecia a alimentação para os empregados; que a alimentação fornecida não era a mesa vendida à clientela; que comiam arroz e feijão, itens que não eram vendidos pela reclamada, essa era a diferença; que ouviu comentários do desmaio da reclamante, mas não estava no dia e não sabe detalhes; que a gerente Rosimeire já deu ordem para lavarem uma carne para melhorar o aspecto e depois tanto ser..."
https://pje.trt2.jus.br/jurisprudencia/36beb11ea39fdf79fa9bc2ec4071ad6d;Processo ROT - 1000314-09.2016.5.02.0382;Acórdão - Data de assinatura: 16/08/2024;Relator(a): Elisa Maria de Barros Pena;Amostras do Inteiro Teor:
https://pje.trt2.jus.br/jurisprudencia/22825a8568454c99d3c0f87d7238049a;Processo ROT - 1000373-10.2023.5.02.0363;Acórdão - Data de assinatura: 14/08/2024;Relator(a): Donizete Vieira da Silva;Amostras do Inteiro Teor:
https://pje.trt2.jus.br/jurisprudencia/f9f031c453207ff461eb900d41f122d7;Processo ATOrd - 1000705-71.2023.5.02.0073;Sentença - Data de assinatura: 13/08/2024;Órgão julgador: 73ª Vara do Trabalho de São Paulo;• Manipulava produtos como fardos de arroz, feijão, açúcar, sal, caixas de bebidas, com peso de 20-30kg. Para tanto, permanecia na posição ortostática/sentado, necessitando realizar a prensa abdominal, principalmente para manipular objetos com carga. Estudos científicos demonstram uma sobrecarga biomecânica da parede abdominal ao manipular carga, associado ou não à rotação das facetas, levando a um estresse nas estruturas osteomusculares locais como ligamentos, fáscias, entre outros....
https://pje.trt2.jus.br/jurisprudencia/e98d484113797619a91cf05d3077169f;Processo ATOrd - 1000128-96.2023.5.02.0072;Sentença - Data de assinatura: 13/08/2024;Órgão julgador: 72ª Vara do Trabalho de São Paulo;• Não há, em seu cardápio, variedade de grelhados e saladas, muito menos são ofertado pratos com arroz, feijão e legumes....
https://pje.trt2.jus.br/jurisprudencia/28f454118ce787e8212f62bd686a3f1d;Processo ATOrd - 1001848-76.2023.5.02.0047;Sentença - Data de assinatura: 12/08/2024;Órgão julgador: 47ª Vara do Trabalho de São Paulo;"• Cortar legumes e preparar o arroz na panela elétrica;Colocar os sushis já finalizados e colocados nas bandejas junto a prateleiras da loja;..."
https://pje.trt2.jus.br/jurisprudencia/7a471f5406349a48ea1d899abe1a1b2c;Processo ATSum - 1000760-66.2024.5.02.0047;Sentença - Data de assinatura: 12/08/2024;Órgão julgador: 47ª Vara do Trabalho de São Paulo;"• porque o filtro do bebedouro não havia sido trocado; que quando saiu da empresa os bebedouros haviam sido trocados acerca de 1 mês; que trabalhavam em uma sala mas o ar condicionado não funcionava; que havia um vidro mas não era janela, e a persiana estava quebrada, de sorte que o sol batia na sala o dia todo; que parte do teto estava mofada; que parte do gesso caiu e havia goteiras quando chovia; que o cheiro da sala era de mofo; que a alimentação fornecida pela empresa terceirizada tinha problemas, como arroz..."
https://pje.trt2.jus.br/jurisprudencia/e89b67743369db0682fcb23e74eae5a1;Processo ATSum - 1000801-80.2023.5.02.0075;Sentença - Data de assinatura: 11/08/2024;Órgão julgador: 75ª Vara do Trabalho de São Paulo;"• -Auxiliar no descarregamento de caminhões; -Abastecer prateleiras com arroz..."
https://pje.trt2.jus.br/jurisprudencia/12c1faf203831105f61525d1ff900954;Processo ATOrd - 1000221-02.2024.5.02.0015;Sentença - Data de assinatura: 10/08/2024;Órgão julgador: 5ª Vara do Trabalho de São Paulo - Zona Leste;• Reclamante alega, na petição inicial, que padece de sequela decorrente de acidente de trabalho ocorrido enquanto empregada da Reclamada: “(...) em meados de maio de 2023, após já iniciado seu expediente diário, ao descer de uma escada, e com baixo nível de luminosidade, transportando frente a seu corpo uma caixa pesada de repolhos, que dificultava sua visibilidade, ao desviar de um carrinho (conhecido como carrinho plataforma) que estava em frente à escada, tropeçou em um pallet carregado de fardos de arroz...
https://pje.trt2.jus.br/jurisprudencia/4ed203746c0f03edb44c3e6917aa1ed9;Processo ATSum - 1000761-23.2024.5.02.0606;Sentença - Data de assinatura: 09/08/2024;Órgão julgador: 6ª Vara do Trabalho de São Paulo - Zona Leste;• Alega o reclamante que “além de realizar as atividades de Operador de Câmara Fria, a Reclamada determinava que o Obreiro realizasse outras atividades, distintas do seu contrato de trabalho, quais sejam: “bater caixa de mercadorias”, repor mercadoria do mercado (feijão/arroz...
https://pje.trt2.jus.br/jurisprudencia/72d4e735491152680d2dcbf4305acca3;Processo ATOrd - 1000446-21.2024.5.02.0371;Sentença - Data de assinatura: 08/08/2024;Órgão julgador: 1ª Vara do Trabalho de Mogi das Cruzes;"• Perito médico assim concluiu (laudo pericial ID. b3374c – fls. 646/647 dos autos): A função auxiliar de serviços gerais por ela executada nos setores de padaria, açougue e frios em supermercados da Ré consistia em limpar o piso, teto, paredes e máquinas, com uso de rodo, vassoura, balde e produtos de limpeza; atender clientes no balcão; vender pães, carnes, frios e laticínios; administrar a equipe de limpeza; cozinhar arroz, feijão e misturas; e preparar saladas...."
https://pje.trt2.jus.br/jurisprudencia/947120f1af3a1ae9afa5c7daa23f0749;Processo ROT - 1000035-77.2023.5.02.0705;Acórdão - Data de assinatura: 07/08/2024;Relator(a): Luciana Carla Correa Bertocco;Ementa:
https://pje.trt2.jus.br/jurisprudencia/29fd7818bae79278c006cf06fb5c4191;Processo ROT - 1000952-04.2022.5.02.0262;Acórdão - Data de assinatura: 07/08/2024;Relator(a): Sonia Aparecida Gindro;Amostras do Inteiro Teor:
https://pje.trt2.jus.br/jurisprudencia/f47c085b92b910a263206f6a2ce707b2;Processo ATOrd - 1001777-07.2023.5.02.0716;Sentença - Data de assinatura: 06/08/2024;Órgão julgador: 16ª Vara do Trabalho de São Paulo - Zona Sul;"• As testemunhas ouvidas, por sua vez, asseveraram:“que  o depoente era repositor de FLV e o reclamante era repositor de mercearia;  que  o reclamante fazia a reposição de leite e também de produtos como feijão e arroz; que visualizava o reclamante fazendo a reposição; que  no  turno  do reclamante  haviam  5  repositores”;“que  o  reclamante  fazia  reposição,  subia mercadorias do estoque e abastecia as prateleiras; que o reclamante..."
https://pje.trt2.jus.br/jurisprudencia/9ef6f794a6b1d34c51f112ac8052e6ff;Processo ATOrd - 1001537-41.2022.5.02.0461;Sentença - Data de assinatura: 03/08/2024;Órgão julgador: 1ª Vara do Trabalho de São Bernardo do Campo;"• Patricia Vieira de Mendonça declarou que: “...recebiam prato comercial da própria empresa, proteína, arroz, feijão e salada;...”..."
https://pje.trt2.jus.br/jurisprudencia/e95459181cb0048d063c5048ea1ea81a;Processo ATOrd - 1000588-84.2024.5.02.0707;Sentença - Data de assinatura: 02/08/2024;Órgão julgador: 7ª Vara do Trabalho de São Paulo - Zona Sul;• Diz que dentre inúmeros ramos de atividades que atua, comercializa sementes (arroz) e para tanto, firma contratos com grandes produtores rurais chamados “multiplicadores” para compra dessas sementes (arroz) e, no caso vertente, firmou contrato de multiplicação de arroz em casca para sementes (Id. 739faa5 - contrato de multiplicação) com Marcia Marta Hamann Arns e que já havia mantido contrato de multiplicação com o genitor da família Arns –...
https://pje.trt2.jus.br/jurisprudencia/a9a3bded39f881e4dad397415e7b5bf2;Processo ATSum - 1000535-12.2024.5.02.0317;Sentença - Data de assinatura: 02/08/2024;Órgão julgador: 7ª Vara do Trabalho de Guarulhos;"• E a única testemunha ouvida narrou que: “a gerente de loja da reclamante era Jéssica e o gerente do plantão são Yuri e Renato; que Camile trabalhou na ré; que o relacionamento da reclamante e Camile era de gerente e empregado; que a depoente não presenciou ofensas, mas houve um desentendimento entre Camile e a reclamante; que a reclamante se recusou a usar um EPI e Camile disse que iria dar uma advertência para a reclamante; que durante a semana havia fornecimento de refeição consistente em arroz..."
https://pje.trt2.jus.br/jurisprudencia/61866f944cb3d31e226f137d4ce93e5c;Processo ATOrd - 1000587-02.2024.5.02.0707;Sentença - Data de assinatura: 02/08/2024;Órgão julgador: 7ª Vara do Trabalho de São Paulo - Zona Sul;• Diz que dentre inúmeros ramos de atividades que atua, comercializa sementes (arroz) e para tanto, firma contratos com grandes produtores rurais chamados “multiplicadores” para compra dessas sementes (arroz) e, no caso vertente, firmou contrato de multiplicação de arroz em casca para sementes (Id. 739faa5 - contrato de multiplicação) com Marcia Marta Hamann Arns e que já havia mantido contrato de multiplicação com o genitor da família Arns –...
https://pje.trt2.jus.br/jurisprudencia/71d923ff291514e2d183ce480893477a;Processo ATOrd - 1000584-47.2024.5.02.0707;Sentença - Data de assinatura: 02/08/2024;Órgão julgador: 7ª Vara do Trabalho de São Paulo - Zona Sul;• Diz que dentre inúmeros ramos de atividades que atua, comercializa sementes (arroz) e para tanto, firma contratos com grandes produtores rurais chamados “multiplicadores” para compra dessas sementes (arroz) e, no caso vertente, firmou contrato de multiplicação de arroz em casca para sementes (Id. 739faa5 - contrato de multiplicação) com Marcia Marta Hamann Arns e que já havia mantido contrato de multiplicação com o genitor da família Arns –...
https://pje.trt2.jus.br/jurisprudencia/c054dbb6747d05e3cf2b6a6b6c94960d;Processo ATOrd - 1000565-41.2024.5.02.0707;Sentença - Data de assinatura: 31/07/2024;Órgão julgador: 7ª Vara do Trabalho de São Paulo - Zona Sul;• Diz que dentre inúmeros ramos de atividades que atua, comercializa sementes (arroz) e para tanto, firma contratos com grandes produtores rurais chamados “multiplicadores” para compra dessas sementes (arroz) e, no caso vertente, firmou contrato de multiplicação de arroz em casca para sementes (Id. 739faa5 - contrato de multiplicação) com Marcia Marta Hamann Arns e que já havia mantido contrato de multiplicação com o genitor da família Arns –...
